filename,reward_name,desc,,
aleksandr-krest,"Крест ""За заслуги"" имени Императора Александра I",∅,,
beethoven,Медаль Людвига ван Бетховена,∅,,
bolsaia-zvezda-s-koronoi,Почетный знак Большая звезда с короной,∅,,
deutsche-orden-80,Памятная медаль Немецкого ордена,∅,,
ehrlich,Медаль Пауля Эрлиха,<p>,"Пауль Эрлих родился в Штрелене, Силезия (ныне  Стшелин, Польша). Поступил в университет в Бреслау (ныне Вроцлав), где проучился лишь один семестр, потом перевелся в Страсбургский университет. Здесь проявилась его склонность к химии, хотя он и не занимался ею. Через два года он возвращаеться в Бреслау и выполняет основную часть работ, необходимых для получения медицинского диплома, который ему вручили в Лейпцигском университете в 1878 году.

Неизвестно, на сколько бы лет медицина отстала в своем развитии, если бы Эрлих не ввел в нее химиотерапию. Путь Эрлиха в науке начался с красок и был связан с окраской клеток крови. В 1878 году он работал старшим врачом Берлинской клиники, занимался вопросом окраски и разработал собственные методы, которыми он пользовался при гистологических исследованиях. Он окрашивал колонии бактерий на стекле, затем стал окрашивать ткани животных, погибших от заразных болезней, и, наконец, решил окрасить бактерии, попавшие в живой организм. Именно с этой целью он ввел однажды в кровь зараженного кролика метиленовую синь. Каково же было его удивление, когда после вскрытия трупа он увидел, что мозг и все нервы окрасились в голубой цвет, а другие ткани остались не окрашенными. «Если есть краска, окрашивающая одну только ткань, то, конечно же, должна найтись и такая, которая окрасит только микробы, попавшие в организм»,  считал ученый. Это наблюдение за результатом опыта дало толчок к возникновению знаменитой теории «магической пули», которая могла бы расправиться с паразитическими микробами одним метким ударом. Это была «терапия стерилизанс магна», полностью очищающая организм от бактерий. Роль «магической пули» должен был сыграть вновь найденный краситель.

П.Эрлих преподавал медицину в Берлинском университете, работал у Роберта Коха в Институте инфекционных заболеваний в Берлине, в Институте по изучению и проверке сывороток в Штеглице, в Терапевтическом институте близ Франкфурта-на-Майне. Основные научные работы Эрлиха посвящены проблеме иммунитета, разработке методов лечения инфекционных болезней, изучению химии лекарственных веществ. Пауль Эрлих сформулировал первую химическую интерпретацию иммунологических реакций  «теорию боковых цепей». Доказал возможность целенаправленного синтеза химиотерапевтических средств. Совместно с А. Бертхеймом он создал препараты сальварсан и неосальварсан, которые произвели революцию в лечении сифилиса, фрамбезии, куриного спирохетоза, возвратной лихорадки. Получил препарат трипанрот  эффективное средство против трипаносомозов. Эрлих разработал и предложил биопромышленные методы изготовления и стандартизации противодифтерийной и других сывороток. Установил, что растительные токсины из клещевины вызывают специфический иммунитет у человека и животных. Описал различные формы лейкоцитов крови. Показал значение костного мозга и лимфоидных органов в кроветворении. Эрлиху принадлежат многочисленные труды по гематологии, гистологии, онкологии.

В 1908 году за работы по иммунологии и разработку фагоцитарной теории иммунитета Паулю Эрлиху совместно с И.И. Мечниковым была присуждена Нобелевская премия по физиологии и медицине.

Европейская академия естественных наук учредила медаль в память великого ученого Европы  Пауля Эрлиха.",</p>
freud,Медаль Зигмунда Фрейда,∅,,
friedrich-die-grosste,Медаль Фридриха Великого,∅,,
gauss,Медаль Иоганна Карла Фридриха Гаусса,<p>,"Президиум Академии утвердил ""Положение о медали Гаусса"" и рассмотрел порядок организации вручения награды. Предложено каждому национальному Отделению или профильной Секции организовать Комиссию по представлению к данной награде.

В Республике Казахстан председателем Комиссии утвержден проф. доктор физ-мат. наук С.Б. Дубовиченко.

Президент Академии
профессор Владимир Тыминский.


Положение о медали Иоганна Карла Фридриха Гаусса (Carl Friederich Gauss)
«За достижения в математике, физике, астрономии и геодезии»

Рассмотрено и утверждено на заседании Президиума Академии № 05 от 30.03.2014

Президиум Европейской академии естественных наук ( Ганновер, Германия ) признал необходимым учредить медаль Карла Гаусса (1777 – 1855).

Эта медаль учреждается Академией для поощрения талантливых ученых и специалистов, осуществляющих работы в области математике, физике, астрономии, геодезии и прикладных знаний, а также внесших значительный вклад в применение научных достижений.

    1. Медалью Карла Гаусса награждаются:
        1. ученые, специалисты и изобретатели, чьи исследования, технологии и разработки привели к установлению важных научных достижений, а также за их применение в практической деятельности;
        2. члены Академии за выдающиеся достижения в области математике, физике, астрономии, геодезии и смежных знаний и получившие значительные научные результаты.
    2. Медалью Карла Гаусса также награждаются:
        1. ученые и специалисты, кафедры и факультеты, а также организации (Университеты, научные центры, НИИ и т.д.), занимающиеся исследованиями в этих областях знаний, а также лица содействующие использованию этих достижений в практической деятельности.
    3. Медаль вручается Президиумом Европейской академии естественных наук по представлению общественных организаций и республиканских комиссий различных стран.
    4. Награждение медалью удостоверяется Почетным дипломом установленного образца.
    5. Медаль носится на левой стороне груди.

Президиум Академии",</p>
geote,Медаль Иоганна Вольфганга фон Гёте,∅,,
krest-korona-za-zaslugi,"Орден Большой Серебрянный крест с дубовыми листьями ""За заслуги""",∅,,
krest-ritter-soyuz,"Офицерский крест Международного рыцарского союза (г. Ганновер, Германия)",∅,,
krest,Офицерский крест Международного рыцарского союза,∅,,
krestdub,"Орден Большой Серебрянный крест с короной ""За заслуги""",∅,,
leibniz,Медаль Готфрида Вильгельма Лейбница,<p>,"Готфрид Вильгельм родился в семье профессора философии морали (этики) Лейпцигского университета им. Фридриха Лейбница. Немецкий философ, математик, физик, языковед. В 15-летнем возрасте Готфрид поступил в тот же Лейпцигский университет, где когда-то работал его отец. Спустя 2 года он переходит в Йенский университет, где изучает математику. В Нюрнбергском университете в Альтдорфе успешно защищает диссертацию на соискание степени доктора права, его эрудиция, ясность изложения и ораторский талант вызвали всеобщее восхищение.

Лейбниц был выдающимся ученым-энциклопедистом, проявив себя в различных областях знаний. Немецкий философ, математик, физик, языковед, он внес большой вклад в развитие философии и задолго до Зигмунда Фрейда привёл доказательства существования подсознания человека.

Опередив время на два века, 20-летний Лейбниц задумал проект математизации логики. В это время он изобретает собственную конструкцию арифмометра, который может выполнять умножение, деление и извлечение корней. В 1673 году в Лондоне на заседании Королевского общества, а затем и во Французской академии наук Лейбниц демонстрирует свой арифмометр и избирается членом этого Общества. Лейбниц завершает свой вариант математического анализа, тщательно продумывает его символику и терминологию. В 1684 Лейбниц публикует первую в мире крупную работу по дифференциальному исчислению. Независимо от Ньютона он создал математический анализ  дифференциальное и интегральное исчисление. Через два года Лейбниц устанавливает подразделение вещественных чисел на алгебраические и трансцендентные; ещё раньше он аналогично классифицировал кривые линии. Впервые в печати ученый вводит символ интеграла и указывает, что эта операция обратна дифференцированию. Лейбниц также описал двоичную систему счисления с цифрами 0 и 1, на которой основана современная компьютерная техника. Почти все его нововведения утвердились в науке.

В 1700 году Лейбниц основывает Берлинскую академию наук и становится её первым президентом. Избирается иностранным членом Парижской академии наук.

В 1697 году, во время путешествия Петра I по Европе, русский царь познакомился с Лейбницем, что послужило началом развития научных исследований в России по западноевропейскому образцу и созданию Академии наук в Петербурге. От Петра Лейбниц получил титул тайного юстиции советника и пенсию в 2000 гульденов.

Лейбниц стал первым гражданским лицом Германии, которому был воздвигнут памятник. В честь Лейбница назван университет в Ганновере.

Готфрид Вильгельм Лейбниц скончался в 1716 году. За его гробом шёл только его личный секретарь.

ЕАЕН учредила медаль в память об этом великом ученом.",</p>
leonhard_euler,Медаль Леонарда Эйлера,∅,,
loenardo-da-vinci,Медаль Леонардо да Винчи,∅,,
mammadov,Персональная  медаль академика ЕАЕН Маммадова  Сакита Гулам оглы,∅,,
maria-romanova,Медаль Мария Павловна Романова - дочь Императора Павла 1,<p>,"В 1804 году в Санкт-Петербурге дочь российского царя Павла, великая княжна Мария Павловна, обвенчалась с наследным принцем Саксен-Веймар-Эйзенахским Карлом Фридрихом, сыном великого герцога Карла Августа и принцессы Луизы Августы Гессен-Дармштадтской.

Мария Павловна проявила стремление к серьезным занятиям и незаурядные музыкальные способности, чем произвела на веймарское общество самое благоприятное впечатление и оказала значительное влияние на духовную и культурную жизнь веймарского «двора муз». Одаренная природным умом, Мария Павловна в первые годы своего замужества пополнила своё образование беседами с выдающимися людьми и уроками профессоров Йенского университета.

Когда её муж стал великим герцогом, Мария Павловна приняла на себя покровительство наукам и искусствам. Трудами Марии Павловны был создан музей, посвященный памяти Гёте, Шиллера, Христофа Мартина Виланда и Гердера, прославивших Веймар своей литературной деятельностью, с ними она дружила и им покровительствовала. Во дворце были выделены покои, получившие название Dichtersale  – «Залы поэтов», а на лестнице стояли бюсты людей, в свое время способствовавших славе Веймара: художника Лукаса Кранаха, композитора Иоганна Себастьяна Баха, композитора, пианиста-виртуоза и дирижера Иоганна Гуммеля. В 1842 году она пригласила в Веймар Ференца Листа, что еще более укрепило славу города. Гёте, принадлежавший к числу друзей Марии Павловны, называл её одной из лучших и наиболее выдающихся женщин своего времени. Она устраивала при дворе литературные вечера – это был известный на всю Европу «веймарский кружок», где йенские профессора читали лекции.

При поддержке Марии Павловны для университета в Йене приобретались самые современные астрономические и физические приборы, химические препараты, пополнялись коллекции. Одна из них  – собрание восточных монет – своим богатством обязана исключительно герцогине. Пополнилось собрание географических карт, рукописей, печатей, археологических находок. Мария Павловна расширила Веймарскую библиотеку, основанную герцогиней Анной Амалией. В 1831 году при содействии Гёте и Майера Мария Павловна основала Общество по распространению лучших произведений новой литературы Германии.

В 1814–1815 годах вместе со своим свёкром, получившим титул великого герцога, и братом Александром I Мария Павловна участвовала в Венском конгрессе, на котором собрались главы европейских княжеств и видные государственные деятели. По окончании войны с Наполеоном, после продолжительного времени бедствий, ею были созданы ссудные кассы для «вспоможения бедным», появились работные дома для взрослых, различные ремесленные школы. Мария Павловна создала Женское благотворительное общество, комитеты которого оказывали бесплатную медицинскую помощь на дому, снабжали бедняков лекарствами, организовывали социальные ясли. На протяжении 55 лет она снискала большую любовь и популярность, благодаря меценатству и благотворительной деятельности.

После смерти Николая I на престол вступил его сын Александр II, и Мария Павловна присутствовала на его коронации. Это было последнее посещение ею родины.

У Марии Павловны и Карла Фридриха были два сына и две дочери: Павел Александр (скончался в детстве); Мария Луиза, супруга принца Карла Прусского; Августа, германская императрица и королева Пруссии, супруга Вильгельма I; Карл Александр, следующий великий герцог. Таким образом, Мария Павловна была бабкой кайзера Фридриха III и прабабкой Вильгельма II.

11 (23) июня 1859 года Мария Павловна скончалась. Она была похоронена рядом с мужем в мавзолее, рядом с которым была воздвигнута православная церковь Святой Марии Магдалины, украшенная иконостасом, созданным руками мастеров из России.",</p>
maria-teresia,Юбилейная медаль Марии Терезии,∅,,
mendel,Медаль Иоганна Грегора Менделя,∅,,
mozart,Медаль Вольфганга Амадея Моцарта,∅,,
negovskiy,"Медаль академика РАМН, проф. В.А. Неговского",∅,,
offizier-krest-malta-orden,Офицерский крест Междунородного союза рыцарей - кавалеров Мальтийского Ордена,∅,,
orden-chesti,Европейский Орден чести,∅,,
orden-drujbi,Орден Дружбы,∅,,
orden-otechestvo-saslugi,"Памятный крест ""За заслуги перед Отечеством""",∅,,
pirogov,Европейский орден имени Николая Пирогова,∅,,
pocxhetnii-krest-za-zaslugi,"Европейский орден Почетный крест ""За заслуги""",∅,,
popov,Медаль А.С. Попова,∅,,
rembrandt,Медаль Рембрандта,∅,,
