filename,reward_name,desc,,
robert-koch,Медаль Роберта Коха,<p>,"Роберт Кох родился в Клаусталь-Целлерфельде (Германия). Окончив гимназию, он становится студентом Геттингенского университета, где в течение двух семестров изучает естественные науки, физику и ботанику, а затем медицину. В 1866 году Роберт получает медицинский диплом.

В 1870 году началась франко-прусская война и Роберт Кох добровольно становится врачом полевого госпиталя, где приобретает опыт в лечении инфекционных болезней, в частности, холеры и брюшного тифа.

После демобилизации в 1871 году Роберт Кох был назначен уездным санитарным врачом в Вольштейне, в окрестностях которого им обнаружено распространение сибирской язвы. Методично проведя серию тщательных экспериментов, Р. Кох установил возбудителя сибирской язвы. Исследования Коха впервые доказали бактериальное происхождение заболевания, и его статьи по проблемам сибирской язвы были опубликованы в научных журналах.

В 1880 году он становится советником в Имперском отделении здравоохранения в Берлине. Р. Кох опубликует работу ""Методы изучения патогенных организмов"", в которой описаны способы выращивания микробов в твердых средах.

В то время в Германии от туберкулеза умирал каждый седьмой, и Роберт Кох направляет свои усилия на обнаружение возбудителя туберкулеза. Он проводит серию опытов над морскими свинками и обнаруживает бактерии в виде палочек, которые при посеве в питательную среду (сыворотку крови животных) дали бурный рост. В 1882 году Роберт Кох объявляет о своем открытии. В публикациях ученого по проблемам туберкулеза впервые были обозначены принципы, которые затем стали называться постулатами Коха.

По заданию Германии работая в Индии, Кох выявил микроб, вызывающий холеру. Научные открытия поставили Р.Коха на уровень ведущего в мире специалиста, определяющего направления в развитии здравоохранения, и, в частности, он становится ответственным за координацию исследований и практических мер в борьбе с такими инфекционными заболеваниями, как брюшной тиф, малярия, чума крупного рогатого скота, сонная болезнь и чума человека.

В 1885 году Роберт Кох стал профессором Берлинского университета и директором только что созданного Института гигиены. В это же время он продолжает исследовать пути лечения туберкулеза, и в 1890 году объявляет о том, что такой способ им найден. В 1905 году Р.Кох получает полное признание и за ""исследования и открытия, касающиеся лечения туберкулеза"" удостаивается Нобелевской премии по физиологии и медицине.

В 1906 году ученый был награжден прусским орденом Почета. Он был удостоен почетных докторских степеней университетов Гейдельберга и Болоньи. Роберт Кох стал иностранным членом Французской академии наук, Лондонского королевского научного общества, Британской медицинской ассоциации и многих других научных обществ, был избран членом-корреспондентом Императорской академии в Санкт-Петербурге.

Имя Нобелевского лауреата Роберта Коха известно во всем мире. Вот почему Европейская академия естественных наук, отдавая должное научным заслугам Роберта Коха и принимая во внимание юбилейную дату – в 2005 году состоялось 100-летие присуждения ученому Нобелевской премии – учредила специальную медаль Роберта Коха.",</p>
roentgen,Медаль Вильгелма Конрада Рентгена,<p>,"Крупнейший немецкий физик-экспериментатор Вильгельм Конрад Рентген, родился в Леннепе, близ Дюссельдорфа. В 1868 в Высшей технической школе Цюриха он получил диплом инженера, спустя год ему присуждают степень доктора философии. После защиты диссертации он целиком посвящает свою жизнь изучению физики, работая сначала ассистентом на кафедре физики в Цюрихе, затем в Вюрцбургском (1871 - 1873), и в 1874 году - Страсбургском университете. С 1888 по 1900 год Рентген - профессор, а с 1894 - ректор Вюрцбургского университета. Последним местом его работы был университет в Мюнхене, где он, достигнув предусмотренного правилами предельного возраста занимаемой должности, передал свою кафедру преемнику, хотя работать продолжал до конца жизни.

Современники, оценивая значимость его работ, переименовали открытые им в 1895 году Х-лучи в «рентгеновское излучение». Открытие Рентгена радикально изменило представления о шкале электромагнитных волн. Лучи Рентгена, позволявшие увидеть то, что прежде было невидимым, произвели на его современников сильнейшее впечатление. По научной и прикладной значимости это открытие стало неоценимо важным, но, может быть, не менее важным было и то, что они качественно обогатили наши представления о материи.

В личности Рентгена соединились прекрасные качества: великий ученый, глубоко интеллигентный и удивительно скромный человек, не пожелавший воспользоваться своим правом первооткрывателя получить патенты и извлекать материальные выгоды. Он отказался от публичной речи перед членами Шведской королевской академии при получении им в 1901 году - первым из физиков - Нобелевской премии. Крупная и цельная личность в науке и в жизни, Рентген заслуженно пользовался славой лучшего экспериментатора. Среди других работ Рентгена - изучение пьезоэлектрических и пироэлектрических свойств кристаллов, взаимосвязи электрических и оптических явлений в них, исследования по магнетизму, послужившие основанием электронной теории Х. Лоренца. Рентген был удостоен многих престижных наград: медали Б. Румфорда, Королевского отличия Баварской короны, ордена ""Железный крест"" от германского правительства и др. Рентген был классиком во всех смыслах этого слова: его труды оказали огромное влияние как на науку, так и на технику. Сегодня совершенно невозможно представить развитие науки и техники без рентгеновских лучей, это открытие совершило подлинную революцию: на его базе появились новые технологии, приборы и тысячи изобретений. В честь В. Рентгена названы и получили развитие новые научные направления: рентгеновская дефектоскопия, микроскопия, спектроскопия, астрономия, топография, рентгеновский структурный анализ, рентгенография, рентгенология, рентгенотерапия и т.д. В связи с 80-летием со дня смерти великого ученого Европейская академия естественных наук учредила специальную памятную медаль Вильгельма Конрада Рентгена.",</p>
saint-georgii,Медаль Св. Георгия,∅,,
schiller,Медаль Фридриха фон Шиллера,∅,,
schweizer,Медаль Альберта Швейцера,<p>,"А. Швейцер родился в городке Кайзерберг (Верхний Эльзас), в семье потомственного протестантского священника. От своих предков А. Швейцер унаследовал прежде всего потребность приносить пользу страждущим и отношение к труду как высшему моральному долгу. В 18 лет он поступает в Страсбургский университет, получает блестящее теологическое и философское образование, изучает теорию музыки, слушает лекции в парижской Сорбонне и Берлинском университете. В 24 года ему присуждают степень доктора философии.

А. Швейцер выбирает путь проповедника, в 1899 году становится викарием в церкви св. Николая в Страсбурге. С 1901 года одновременно и преподает в Страсбургском университете, и дает органные концерты. Европейскую известность приносит ему книга о И.С. Бахе. Жизнь, до краев наполненная творчеством, страстным служением людям, приносит ему постоянную радость. Однако в его судьбе происходит загадочный для многих поворот - в самом же деле ему казалось невозможным вести такую безмятежную жизнь, в то время как множество людей вокруг вынуждены беспрерывно бороться с лишениями и страданиями. В тридцатилетнем возрасте в ореоле славы он поступает на медицинский факультет Страсбургского университета. Местом для своей медицинской практики А. Швейцер выбирает Габон в Центральной Африке, где условия существования были весьма тяжелыми. С 1913 года всю последующую жизнь, за исключением поездок в Европу, связанных с необходимостью сборов средств для больницы, он работает врачом вместе с женой в маленьком местечке Ламбарене. К нему отовсюду приезжали прекрасные и жертвенные люди, которые вместе с ним совершали настоящий человеческий подвиг, несмотря на неимоверно тяжелые для европейцев бытовые условия. Неоценимый вклад сделан А. Швейцером и его соратниками в борьбу с проказой на территории Габона и сопредельными странами. Габон - одна из наиболее пораженных лепрой стран мира (она зарегистрирована у 2,3% населения). Ламбаренский лепрозорий начали строить в 1953, а завершили в 1957 году, строительство и обустройство осуществлено Швейцером на деньги от Нобелевской премии. Одновременно он продолжает заниматься наукой, музыкой, просветительской деятельностью за пределами Африки.  В период с 1933 по 1939 год университеты Европы присудили ему несколько почетных докторских степеней. Вместе с Эйнштейном он принимает самое горячее участие в борьбе против ядерной угрозы. Альберт Швейцер проявлял и исповедовал истинное человеколюбие и добро. Когда 3 сентября 1965 года из Габона пришла скорбная весть о кончине Альберта Луи Филиппа Швейцера, весь цивилизованный мир испытал глубокую скорбь. Гражданином мира назвал Альберта Швейцера премьер-министр Габона в траурной речи.

Памятная медаль Альберта Швейцера выпущена Европейской академией естественных наук в связи со 100-летием учреждения Нобелевских премий.",</p>
senatorstar,Звезда сенатора Международного рыцарского союза и Европейской Академии Естественных Наук ,∅,,
serebro-zvesda,Большая Серебряная рыцарская звезда,∅,,
sofiorden,Орден имени Софи Тахаловой,∅,,
stiegliz,Медаль Александра фон Штиглица,<p>,"Родился в семье придворного банкира, основателя банкирского дома «Штиглиц и К°», барона Людвига фон Штиглица. Окончив Дерптский университет, А. Л. Штиглиц поступил на государственную службу в Министерство финансов Российской Империи, после смерти отца унаследовал огромное состояние, а также его дело и занял должность придворного банкира. А. Л. Штиглиц занимался предпринимательской деятельностью. Им были основаны Товарищество нарвской суконной мануфактуры в Нарве и Екатерингофская бумагопрядильня. Принимал участие во всех крупных операциях российского правительства на внутреннем и внешнем рынках. Через банкирский дом барона Штиглица правительство России поддерживало отношения с банкирскими домами Амстердама, Лондона и Парижа. А.Л. Штиглиц участвовал в строительстве Петергофской и Балтийской железных дорог и являлся соучредителем Главного общества российских железных дорог. В 1860 году он был назначен управляющим Государственным банком России; в 1862 пожалован в тайные советники, а в 1881 году в действительные тайные советники.

Благотворительная деятельность А.Л. Штиглица касалась прежде всего удовлетворения нужд его подчинённых и была направлена на цели просвещения. В 1843 году он был утверждён почётным членом совета Санкт-Петербургского коммерческого училища и действительным членом совета Санкт-Петербургского высшего коммерческого пансиона. Во время Крымской войны им было сделано два крупных пожертвования на нужды российского воинства. А.Л. Штиглиц внёс значительную сумму на содержание воспитанников в учебных заведениях столицы, а также на сооружение памятника императору Николаю I в биржевом зале. Самым важным и ценным для России было учреждение в Петербурге на средства А.Л. Штиглица Центрального училища технического рисования вместе с богатым художественно-промышленным музеем и отлично оборудованной библиотекой.

За заслуги перед Отечеством Штиглиц был награжден орденами: Святого Станислава I и III степеней за строительство Балтийской железной дороги; Святого Владимира IV степени; Святой Анны I и II степеней за труды по устройству дел Государственного банка и за услуги, оказанные ведомству.

Стоит отметить, что, будучи человеком вполне независимым, капиталы которого охотно принимались во всех странах, А.Л. Штиглиц помещал своё огромное состояние почти исключительно в русских фондах и на скептическое замечание одного финансиста о неосторожности подобного доверия к русским финансам однажды заметил: «Отец мой и я нажили все состояние в России; если она окажется несостоятельной, то и я готов потерять с ней вместе все своё состояние».

24 октября 1884 года Алекса́ндр Лю́двигович фон Шти́глиц скончался и похоронен в Ивангороде в церкви Святой Троицы, лично им сооружённой для духовных нужд местного фабричного населения.",</p>
vernadsky-medali,Медаль Владимира Вернадского,∅,,
