filename,reward_name,desc,,
virhov,Медаль Рудольфа Вирхова,<p>,"Рудольф Вирхов - выдающийся немецкий ученый второй половины XIX столетия, реформатор научной и практической медицины, основоположник современной патологической анатомии. Его именем назван расположенный в центре Берлина основанный им Дом медиков Германии.

Р. Вирхов родился в Шифельбейне, в Померании. По окончании в 1843 году берлинского Медико-хирургического института Фридриха-Вильгельма и после защиты докторской диссертации он работает в клинике Шарите ассистентом при патологоанатомической лаборатории, где с энтузиазмом изучает клеточный материал. В 1846 году он обнаружил клетки глии, из которых состоит мозг.

В 1847 году Вирхов становится профессором Берлинского университета, основывает журнал «Архив патологической анатомии, физиологии и клинической медицины», где печатает свои работы. Этот журнал издается и поныне.

В 1849 году в связи с антимонархической деятельностью ученый лишается места в клинике и вынужден переехать из Берлина в Вюрцбург (Бавария), где становится во главе кафедры патологический анатомии и быстро получает там признание и известность. В 1856 году он вновь приглашен в Берлинский университет на основанную специально для него кафедру патологической анатомии, общей патологии и терапии. Одновременно он создает Патологоанатомический институт и музей, становится директором Института патологии, который делается центром притяжения молодых ученых из разных стран. В этой должности он работает до конца жизни.

До работ Вирхова взгляды на болезнь были довольно элементарны. Он стал основателем совершенно нового направления - целлюлярной (клеточной) патологии, которая объясняет заболевания изменениями в мельчайших частицах организма - клетках. В 1855 году ученый обобщил свои научные взгляды и изложил их в статье своего журнала «Целлюлярная патология». Через 3 года выходит в 2-х томах его труд «Целлюлярная патология как учение, основанное на физиологической и патологической гистологии», оказавший огромное влияние на дальнейшее развитие медицины; он был сразу переведен почти на все языки мира. С тех пор труд ученого регулярно переиздавался во многих странах. Тогда же были напечатаны его лекции, где впервые были систематизированы основные патологические процессы под новым углом зрения, введена терминология для ряда болезней, сохранившаяся и до сего времени («тромбоз», «эмболия», «амилоидное перерождение», «лейкемия» и др.). В России первое издание «Целлюлярной патологии» вышло в 1859 году.

Как деятель в области общественной гигиены, Вирхов известен своими работами по исследованию эпидемий, соединенных с лишениями и голодом. В качестве члена Берлинского муниципалитета ученый активно добивался проведения санитарно-гигиенических мероприятий (в вопросах водоснабжения, канализации и т.п.). Во многом благодаря именно ему Германия достигла высокой степени совершенства в санитарном отношении, на какой стоит и ныне.

Вирхов активно занимался просветительской деятельностью: в течение 33 лет: издавал научно-популярные сборники по этнологии, антропологии и археологии. Вместе с Г.Шлиманом принимал участие в поисках Трои и систематизировал найденные там черепа. Вирхов становится редактором этнологического журнала, а в 1873 участвует в основании Немецкого антропологического общества, Берлинского общества антропологии, этнологии и древней истории.

Европейская академия естественных наук учредила медаль в память о Рудольфе Вирхове как великом европейском ученом ХIХ века.",</p>
za-zaslugi,"Крест ""За заслуги""",∅,,
zolotaya-zvezda,Большая Золотая рыцарская звезда ,∅,,
zolotoi-orel,Европейский орден Золотой орёл,∅,,